{
  "appId": "prime-shell",
  "productName": "Prime Shell",
  "bundleId": "com.primeshell.desktop",
  "executable": "prime-shell",
  "version": "0.1.0",
  "brand": {
    "accentColor": "#0078D4",
    "publisher": "Prime Builds",
    "description": "Production Fluent desktop shell and document analysis workbench"
  },
  "features": [
    "document-analysis",
    "diagnostics"
  ],
  "operations": [
    "spike.echo",
    "spike.count",
    "spike.crash",
    "spike.hang",
    "spike.largeRejected",
    "doc.analyze"
  ],
  "window": {
    "title": "Prime Shell",
    "width": 1024,
    "height": 768,
    "minWidth": 500,
    "minHeight": 400
  },
  "stateNamespace": "com.primeshell.desktop"
}
